,Title,Author,Total ratings,Average rating,Total reviews,Description,Top Genre,Date published,Pages,Currently reading,Want to read
11,The Giving Tree,Shel Silverstein,1066902.0,4.38,21045.0,"""Once there was a tree...and she loved a little boy.""So begins a story of unforgettable perception, beautifully written and illustrated by the gifted and versatile Shel Silverstein.Every day the boy would come to the tree to eat her apples, swing from her branches, or slide down her trunk...and the tree was happy. But as the boy grew older he began to want more from the tree, and the tree gave and gave and gave.This is a tender story, touched with sadness, aglow with consolation. Shel Silverstein has created a moving parable for readers of all ages that offers an affecting interpretation of the gift of giving and a serene acceptance of another's capacity to love in return.",Childrens,"January 1, 1964",64,"6,703",425k
53,Where the Wild Things Are,Maurice Sendak,962815.0,4.24,13406.0,"Max, a wild and naughty boy, is sent to bed without his supper by his exhausted mother. In his room, he imagines sailing far away to a land of Wild Things. Instead of eating him, the Wild Things make Max their king.",Childrens,"April 9, 1963",38,"2,587",294k
56,Green Eggs and Ham,Dr. Seuss,735120.0,4.3,10930.0,"“Do you like green eggs and ham?” asks Sam-I-am in this Beginner Book by Dr. Seuss. In a house or with a mouse? In a boat or with a goat? On a train or in a tree? Sam keeps asking persistently. With unmistakable characters and signature rhymes, Dr. Seuss’s beloved favorite has cemented its place as a children’s classic. In this most famous of cumulative tales, the list of places to enjoy green eggs and ham, and friends to enjoy them with, gets longer and longer. Follow Sam-I-am as he insists that this unusual treat is indeed a delectable snack to be savored everywhere and in every way. Originally created by Dr. Seuss, Beginner Books encourage children to read all by themselves, with simple words and illustrations that give clues to their meaning.",Childrens,"June 1, 1960",64,"3,732",216k
70,Matilda,Roald Dahl,871438.0,4.33,21654.0,"“The Trunchbull” is no match for Matilda!Matilda is a little girl who is far too good to be true. At age five-and-a-half she's knocking off double-digit multiplication problems and blitz-reading Dickens. Even more remarkably, her classmates love her even though she's a super-nerd and the teacher's pet. But everything is not perfect in Matilda's world...For starters she has two of the most idiotic, self-centered parents who ever lived. Then there's the large, busty nightmare of a school principal, Miss (""The"") Trunchbull, a former hammer-throwing champion who flings children at will, and is approximately as sympathetic as a bulldozer. Fortunately for Matilda, she has the inner resources to deal with such annoyances: astonishing intelligence, saintly patience, and an innate predilection for revenge.
Roald Dahl
 was a spy, ace fighter-pilot, chocolate historian, and medical inventor. He was also the author of Charlie and the Chocolate Factory, Matilda, The BFG, and many more brilliant stories. He remains the World's No. 1 Storyteller.",Childrens,"October 1, 1988",240,"8,920",297k
2,Pride and Prejudice,Jane Austen,3939965.0,4.28,100213.0,"Since its immediate success in 1813, Pride and Prejudice has remained one of the most popular novels in the English language. Jane Austen called this brilliant work ""her own darling child"" and its vivacious heroine, Elizabeth Bennet, ""as delightful a creature as ever appeared in print."" The romantic clash between the opinionated Elizabeth and her proud beau, Mr. Darcy, is a splendid performance of civilized sparring. And Jane Austen's radiant wit sparkles as her characters dance a delicate quadrille of flirtation and intrigue, making this book the most superb comedy of manners of Regency England.Alternate cover edition of ISBN 9780679783268",Classics,"January 28, 1813",279,197k,2m
10,Gone with the Wind,Margaret Mitchell,1178107.0,4.3,22952.0,"Scarlett O'Hara, the beautiful, spoiled daughter of a well-to-do Georgia plantation owner, must use every means at her disposal to claw her way out of the poverty she finds herself in after Sherman's March to the Sea.",Classics,"June 30, 1936",1037,17.5k,789k
12,The Picture of Dorian Gray,Oscar Wilde,1368269.0,4.12,57071.0,"Oscar Wilde’s only novel is the dreamlike story of a young man who sells his soul for eternal youth and beauty.In this celebrated work Wilde forged a devastating portrait of the effects of evil and debauchery on a young aesthete in late-19th-century England. Combining elements of the Gothic horror novel and decadent French fiction, the book centers on a striking premise: As Dorian Gray sinks into a life of crime and gross sensuality, his body retains perfect youth and vigor while his recently painted portrait grows day by day into a hideous record of evil, which he must keep hidden from the world. For over a century, this mesmerizing tale of horror and suspense has enjoyed wide popularity. It ranks as one of Wilde's most important creations and among the classic achievements of its kind.",Classics,"June 1, 1890",272,91.5k,1m
13,Wuthering Heights,Emily Brontë,1682671.0,3.88,54190.0,"You can find the redesigned cover of this edition HERE.At the centre of this novel is the passionate love between Catherine Earnshaw and Heathcliff - recounted with such emotional intensity that a plain tale of the Yorkshire moors acquires the depth and simplicity of ancient tragedy.This best-selling Norton Critical Edition is based on the 1847 first edition of the novel. For the Fourth Edition, the editor has collated the 1847 text with several modern editions and has corrected a number of variants, including accidentals. The text is accompanied by entirely new explanatory annotations.New to the fourth Edition are twelve of Emily Bronte's letters regarding the publication of the 1847 edition of Wuthering Heights as well as the evolution of the 1850 edition, prose and poetry selections by the author, four reviews of the novel, and poetry selections by the author, four reviews of the novel, and Edward Chitham's insightful and informative chronology of the creative process behind the beloved work.Five major critical interpretations of Wuthering Heights are included, three of them new to the Fourth Edition. A Stuart Daley considers the importance of chronology in the novel. J. Hillis Miller examines Wuthering Heights's problems of genre and critical reputation. Sandra M. Gilbert assesses the role of Victorian Christianity plays in the novel, while Martha Nussbaum traces the novel's romanticism. Finally, Lin Haire-Sargeant scrutinizes the role of Heathcliff in film adaptations of Wuthering Heights. A Chronology and updated Selected Bibliography are also included.",Classics,"December 1, 1847",464,76.5k,1m
18,The Great Gatsby,F. Scott Fitzgerald,4834840.0,3.93,93911.0,"Alternate Cover Edition ISBN: 0743273567 (ISBN13: 9780743273565)The Great Gatsby, F. Scott Fitzgerald's third book, stands as the supreme achievement of his career. This exemplary novel of the Jazz Age has been acclaimed by generations of readers. The story of the fabulously wealthy Jay Gatsby and his love for the beautiful Daisy Buchanan, of lavish parties on Long Island at a time when The New York Times noted ""gin was the national drink and sex the national obsession,"" it is an exquisitely crafted tale of America in the 1920s.The Great Gatsby is one of the great classics of twentieth-century literature.(from the back cover)",Classics,"April 10, 1925",180,125k,2m
19,Alice's Adventures in Wonderland / Through the Looking-Glass,Lewis Carroll,536263.0,4.06,14109.0,"""I can't explain myself, I'm afraid, sir,"" said Alice, ""Because I'm not myself, you see.""When Alice sees a white rabbit take a watch out of its waistcoat pocket she decides to follow it, and a sequence of most unusual events is set in motion. This mini book contains the entire topsy-turvy stories of Alice's Adventures in Wonderland and Through the Looking-Glass, accompanied by practical notes and Martina Pelouso's memorable full-colour illustrations.",Classics,"December 27, 1871",239,22.6k,287k
21,The Little Prince,Antoine de Saint-Exupéry,1921543.0,4.32,59812.0,"A pilot stranded in the desert awakes one morning to see, standing before him, the most extraordinary little fellow. ""Please,"" asks the stranger, ""draw me a sheep."" And the pilot realizes that when life's events are too difficult to understand, there is no choice but to succumb to their mysteries. He pulls out pencil and paper... And thus begins this wise and enchanting fable that, in teaching the secret of what is really important in life, has changed forever the world for its readers.Few stories are as widely read and as universally cherished by children and adults alike as The Little Prince, presented here in a stunning new translation with carefully restored artwork. The definitive edition of a worldwide classic, it will capture the hearts of readers of all ages.",Classics,"April 6, 1943",96,31.3k,722k
24,Les Misérables,Victor Hugo,769421.0,4.2,21360.0,"Victor Hugo's tale of injustice, heroism and love follows the fortunes of Jean Valjean, an escaped convict determined to put his criminal past behind him. But his attempts to become a respected member of the community are constantly put under threat: by his own conscience, when, owing to a case of mistaken identity, another man is arrested in his place; and by the relentless investigations of the dogged Inspector Javert. It is not simply for himself that Valjean must stay free, however, for he has sworn to protect the baby daughter of Fantine, driven to prostitution by poverty.",Classics,"January 1, 1862",1463,80.9k,844k
25,Crime and Punishment,Fyodor Dostoevsky,819494.0,4.26,30405.0,"Raskolnikov, a destitute and desperate former student, wanders through the slums of St Petersburg and commits a random murder without remorse or regret. He imagines himself to be a great man, a Napoleon: acting for a higher purpose beyond conventional moral law. But as he embarks on a dangerous game of cat and mouse with a suspicious police investigator, Raskolnikov is pursued by the growing voice of his conscience and finds the noose of his own guilt tightening around his neck. Only Sonya, a downtrodden sex worker, can offer the chance of redemption.",Classics,"January 1, 1866",671,85.1k,887k
27,Romeo and Juliet,William Shakespeare,2467249.0,3.74,27570.0,"In Romeo and Juliet, Shakespeare creates a violent world, in which two young people fall in love. It is not simply that their families disapprove; the Montagues and the Capulets are engaged in a blood feud.In this death-filled setting, the movement from love at first sight to the lovers’ final union in death seems almost inevitable. And yet, this play set in an extraordinary world has become the quintessential story of young love. In part because of its exquisite language, it is easy to respond as if it were about all young lovers.",Classics,"January 1, 1597",281,65.9k,610k
1,Harry Potter and the Order of the Phoenix,J.K. Rowling,3144475.0,4.5,57016.0,"Harry Potter is about to start his fifth year at Hogwarts School of Witchcraft and Wizardry. Unlike most schoolboys, Harry never enjoys his summer holidays, but this summer is even worse than usual. The Dursleys, of course, are making his life a misery, but even his best friends, Ron and Hermione, seem to be neglecting him.Harry has had enough. He is beginning to think he must do something, anything, to change his situation, when the summer holidays come to an end in a very dramatic fashion. What Harry is about to discover in his new year at Hogwarts will turn his world upside down...",Fantasy,"June 21, 2003",912,67.5k,465k
7,J.R.R. Tolkien 4-Book Boxed Set: The Hobbit and The Lord of the Rings,J.R.R. Tolkien,127291.0,4.61,2119.0,"This four-volume, boxed set contains J.R.R. Tolkien's epic masterworks The Hobbit and the three volumes of The Lord of the Rings (The Fellowship of the Ring, The Two Towers, and The Return of the King).In The Hobbit, Bilbo Baggins is whisked away from his comfortable, unambitious life in Hobbiton by the wizard Gandalf and a company of dwarves. He finds himself caught up in a plot to raid the treasure hoard of Smaug the Magnificent, a large and very dangerous dragon.The Lord of the Rings tells of the great quest undertaken by Frodo Baggins and the Fellowship of the Ring: Gandalf the wizard; the hobbits Merry, Pippin, and Sam; Gimli the dwarf; Legolas the elf; Boromir of Gondor; and a tall, mysterious stranger called Strider. J.R.R. Tolkien's three volume masterpiece is at once a classic myth and a modern fairy tale—a story of high and heroic adventure set in the unforgettable landscape of Middle-earth",Fantasy,"October 20, 1955",1728,"2,255",64.7k
8,The Chronicles of Narnia,C.S. Lewis,616475.0,4.27,11933.0,"Librarian note: An alternate cover for this edition can be found here: 2005.Journeys to the end of the world, fantastic creatures, and epic battles between good and evil—what more could any reader ask for in one book? The book that has it all is The Lion, the Witch and the Wardrobe, written in 1949 by Clive Staples Lewis. But Lewis did not stop there. Six more books followed, and together they became known as The Chronicles of Narnia.For the past fifty years, The Chronicles of Narnia have transcended the fantasy genre to become part of the canon of classic literature. Each of the seven books is a masterpiece, drawing the reader into a land where magic meets reality, and the result is a fictional world whose scope has fascinated generations.This edition presents all seven books—unabridged—in one impressive volume. The books are presented here in chronlogical order, each chapter graced with an illustration by the original artist, Pauline Baynes. Deceptively simple and direct, The Chronicles of Narnia continue to captivate fans with adventures, characters, and truths that speak to readers of all ages, even fifty years after they were first published.",Fantasy,"January 1, 1956",767,15.9k,267k
14,Harry Potter and the Philosopher’s Stone,J.K. Rowling,9269547.0,4.47,147092.0,"Harry Potter thinks he is an ordinary boy - until he is rescued by an owl, taken to Hogwarts School of Witchcraft and Wizardry, learns to play Quidditch and does battle in a deadly duel. The Reason ... HARRY POTTER IS A WIZARD!",Fantasy,"June 26, 1997",223,208k,1m
22,The Lightning Thief,Rick Riordan,2691496.0,4.29,84905.0,"Alternate cover for this ISBN can be found herePercy Jackson is a good kid, but he can't seem to focus on his schoolwork or control his temper. And lately, being away at boarding school is only getting worse - Percy could have sworn his pre-algebra teacher turned into a monster and tried to kill him. When Percy's mom finds out, she knows it's time that he knew the truth about where he came from, and that he go to the one place he'll be safe. She sends Percy to Camp Half Blood, a summer camp for demigods (on Long Island), where he learns that the father he never knew is Poseidon, God of the Sea. Soon a mystery unfolds and together with his friends—one a satyr and the other the demigod daughter of Athena - Percy sets out on a quest across the United States to reach the gates of the Underworld (located in a recording studio in Hollywood) and prevent a catastrophic war between the gods.",Fantasy,"July 28, 2005",377,49.5k,836k
43,The Princess Bride,William Goldman,869740.0,4.26,24167.0,"What happens when the most beautiful girl in the world marries the handsomest prince of all time and he turns out to be...well...a lot less than the man of her dreams?As a boy, William Goldman claims, he loved to hear his father read the S. Morgenstern classic, The Princess Bride. But as a grown-up he discovered that the boring parts were left out of good old Dad's recitation, and only the ""good parts"" reached his ears.Now Goldman does Dad one better. He's reconstructed the ""Good Parts Version"" to delight wise kids and wide-eyed grownups everywhere.What's it about? Fencing. Fighting. True Love. Strong Hate. Harsh Revenge. A Few Giants. Lots of Bad Men. Lots of Good Men. Five or Six Beautiful Women. Beasties Monstrous and Gentle. Some Swell Escapes and Captures. Death, Lies, Truth, Miracles, and a Little Sex.In short, it's about everything.",Fantasy,"September 1, 1973",456,16k,768k
45,A Game of Thrones,George R.R. Martin,2353909.0,4.44,60525.0,"alternate cover editions can be found here, here and hereLong ago, in a time forgotten, a preternatural event threw the seasons out of balance. In a land where summers can last decades and winters a lifetime, trouble is brewing. The cold is returning, and in the frozen wastes to the north of Winterfell, sinister forces are massing beyond the kingdom’s protective Wall. To the south, the king’s powers are failing—his most trusted adviser dead under mysterious circumstances and his enemies emerging from the shadows of the throne. At the center of the conflict lie the Starks of Winterfell, a family as harsh and unyielding as the frozen land they were born to. Now Lord Eddard Stark is reluctantly summoned to serve as the king’s new Hand, an appointment that threatens to sunder not only his family but the kingdom itself.Sweeping from a harsh land of cold to a summertime kingdom of epicurean plenty, A Game of Thrones tells a tale of lords and ladies, soldiers and sorcerers, assassins and bastards, who come together in a time of grim omens. Here an enigmatic band of warriors bear swords of no human metal; a tribe of fierce wildlings carry men off into madness; a cruel young dragon prince barters his sister to win back his throne; a child is lost in the twilight between life and death; and a determined woman undertakes a treacherous journey to protect all she holds dear. Amid plots and counter-plots, tragedy and betrayal, victory and terror, allies and enemies, the fate of the Starks hangs perilously in the balance, as each side endeavors to win that deadliest of conflicts: the game of thrones.",Fantasy,"August 6, 1996",835,112k,976k
60,Harry Potter and the Deathly Hallows,J.K. Rowling,3465002.0,4.62,79409.0,"Harry has been burdened with a dark, dangerous and seemingly impossible task: that of locating and destroying Voldemort's remaining Horcruxes. Never has Harry felt so alone, or faced a future so full of shadows. But Harry must somehow find within himself the strength to complete the task he has been given. He must leave the warmth, safety and companionship of The Burrow and follow without fear or hesitation the inexorable path laid out for him...In this final, seventh installment of the Harry Potter series, J.K. Rowling unveils in spectacular fashion the answers to the many questions that have been so eagerly awaited.",Fantasy,"July 21, 2007",759,42.5k,523k
66,Harry Potter and the Prisoner of Azkaban,J.K. Rowling,3803385.0,4.58,75079.0,"Harry Potter, along with his best friends, Ron and Hermione, is about to start his third year at Hogwarts School of Witchcraft and Wizardry. Harry can't wait to get back to school after the summer holidays. (Who wouldn't if they lived with the horrible Dursleys?) But when Harry gets to Hogwarts, the atmosphere is tense. There's an escaped mass murderer on the loose, and the sinister prison guards of Azkaban have been called in to guard the school...",Fantasy,"July 8, 1999",435,65.6k,407k
76,The Fellowship of the Ring,J.R.R. Tolkien,2685174.0,4.38,34194.0,"One Ring to rule them all, One Ring to find them, One Ring to bring them all and in the darkness bind them.In ancient times the Rings of Power were crafted by the Elven-smiths, and Sauron, the Dark Lord, forged the One Ring, filling it with his own power so that he could rule all others. But the One Ring was taken from him, and though he sought it throughout Middle-earth, it remained lost to him. After many ages it fell into the hands of Bilbo Baggins, as told in The Hobbit.In a sleepy village in the Shire, young Frodo Baggins finds himself faced with an immense task, as his elderly cousin Bilbo entrusts the Ring to his care. Frodo must leave his home and make a perilous journey across Middle-earth to the Cracks of Doom, there to destroy the Ring and foil the Dark Lord in his evil purpose.",Fantasy,"July 29, 1954",432,70.6k,725k
31,The Help,Kathryn Stockett,2599082.0,4.47,88486.0,"Three ordinary women are about to take one extraordinary step.Twenty-two-year-old Skeeter has just returned home after graduating from Ole Miss. She may have a degree, but it is 1962, Mississippi, and her mother will not be happy till Skeeter has a ring on her finger. Skeeter would normally find solace with her beloved maid Constantine, the woman who raised her, but Constantine has disappeared and no one will tell Skeeter where she has gone.Aibileen is a black maid, a wise, regal woman raising her seventeenth white child. Something has shifted inside her after the loss of her own son, who died while his bosses looked the other way. She is devoted to the little girl she looks after, though she knows both their hearts may be broken.Minny, Aibileen's best friend, is short, fat, and perhaps the sassiest woman in Mississippi. She can cook like nobody's business, but she can't mind her tongue, so she's lost yet another job. Minny finally finds a position working for someone too new to town to know her reputation. But her new boss has secrets of her own.Seemingly as different from one another as can be, these women will nonetheless come together for a clandestine project that will put them all at risk. And why? Because they are suffocating within the lines that define their town and their times. And sometimes lines are made to be crossed.In pitch-perfect voices, Kathryn Stockett creates three extraordinary women whose determination to start a movement of their own forever changes a town, and the way women, mothers, daughters, caregivers, friends, view one another. A deeply moving novel filled with poignancy, humor, and hope, The Help is a timeless and universal story about the lines we abide by, and the ones we don't. Librarian's note: An alternate cover edition can be found here",Fiction,"February 10, 2009",464,22.9k,851k
39,One Hundred Years of Solitude,Gabriel García Márquez,910621.0,4.11,40971.0,"The brilliant, bestselling, landmark novel that tells the story of the Buendia family, and chronicles the irreconcilable conflict between the desire for solitude and the need for love—in rich, imaginative prose that has come to define an entire genre known as ""magical realism.""",Fiction,"May 1, 1967",417,50k,59.7k
41,The Time Traveler's Wife,Audrey Niffenegger,1735604.0,3.99,51727.0,"This is the extraordinary love story of Clare and Henry, who met when Clare was six and Henry was thirty-six, and were married when Clare was twenty-two and Henry was thirty. Impossible but true, because Henry suffers from a rare condition where his genetic clock periodically resets and he finds himself pulled suddenly into his past or future. In the face of this force they can neither prevent nor control, Henry and Clare's struggle to lead normal lives is both intensely moving and entirely unforgettable.",Fiction,"January 1, 2003",537,14.2k,982k
42,A Thousand Splendid Suns,Khaled Hosseini,1426735.0,4.42,70112.0,"Mariam is only fifteen when she is sent to Kabul to marry the troubled and bitter Rasheed, who is thirty years her senior. Nearly two decades later, in a climate of growing unrest, tragedy strikes fifteen-year-old Laila, who must leave her home and join Mariam's unhappy household. Laila and Mariam are to find consolation in each other, their friendship to grow as deep as the bond between sisters, as strong as the ties between mother and daughter. With the passing of time comes Taliban rule over Afghanistan, the streets of Kabul loud with the sound of gunfire and bombs, life a desperate struggle against starvation, brutality and fear, the women's endurance tested beyond their worst imaginings. Yet love can move people to act in unexpected ways, lead them to overcome the most daunting obstacles with a startling heroism. In the end it is love that triumphs over death and destruction.""A Thousand Splendid Suns"" is a portrait of a wounded country and a story of family and friendship, of an unforgiving time, an unlikely bond, and an indestructible love.",Fiction,"January 1, 2007",372,33k,767k
54,The Kite Runner,Khaled Hosseini,2952222.0,4.33,90988.0,"1970s Afghanistan: Twelve-year-old Amir is desperate to win the local kite-fighting tournament and his loyal friend Hassan promises to help him. But neither of the boys can foresee what would happen to Hassan that afternoon, an event that is to shatter their lives. After the Russians invade and the family is forced to flee to America, Amir realises that one day he must return to an Afghanistan under Taliban rule to find the one thing that his new world cannot grant him: redemption.",Fiction,"January 1, 2003",371,43.3k,1m
57,Life of Pi,Yann Martel,1551049.0,3.93,51475.0,"Life of Pi is a fantasy adventure novel by Yann Martel published in 2001. The protagonist, Piscine Molitor ""Pi"" Patel, a Tamil boy from Pondicherry, explores issues of spirituality and practicality from an early age. He survives 227 days after a shipwreck while stranded on a boat in the Pacific Ocean with a Bengal tiger named Richard Parker.",Fiction,"September 11, 2001",460,25k,730k
